{
  "schemaVersion": 1,
  "suiteId": "local-dashcam-nce9762",
  "title": "Local dashcam case reconstructed from AI evidence",
  "analysisProfileId": "precision",
  "cases": [
    {
      "id": "local-dashcam-nce9762",
      "mode": "interval",
      "sourcePath": "C:/Users/JasonHong/Desktop/CODE/_Project/Traffic/datasets/dev-videos/\u884c\u8eca\u7d00\u9304.mp4",
      "interval": {
        "startMs": 6000,
        "endMs": 26000
      },
      "anchorTimeMs": 19904,
      "sampleEveryMs": 869,
      "maxSamples": 28,
      "targetVehicleKind": "motorcycle",
      "selectedTargetBox": {
        "x": 0.42265625,
        "y": 0.2513888888888889,
        "width": 0.20703125,
        "height": 0.525
      },
      "selectedTargetTrackId": "target-19904-0",
      "countryHints": [
        "TW"
      ],
      "expectedText": "NCE9762",
      "expectation": {
        "kind": "readable",
        "text": "NCE9762"
      },
      "tags": [
        "local",
        "dashcam",
        "night",
        "moving-camera",
        "motorcycle",
        "tw"
      ],
      "analysisOptions": {
        "persistArtifacts": true,
        "debugTag": "local-dashcam-nce9762",
        "trackerMode": "botsort",
        "fusionMode": "aligned-char",
        "restorationMode": "mambairv2",
        "enableRecognizerComparison": true
      },
      "metadata": {
        "dataset": "local-dashcam",
        "split": "manual",
        "category": "tracking",
        "evidenceRunId": "260525-141937-ffbe0a53",
        "fineSelection": {
          "startFrameId": "fine-000",
          "endFrameId": "fine-023",
          "anchorFrameId": "fine-015"
        },
        "targetResolution": {
          "selectedTrackId": "target-19904-0",
          "selectedCandidateId": "baseline-19904-0",
          "confidence": 0.9142037052578135,
          "plateHintConsistency": "supporting"
        }
      }
    }
  ]
}